{
  "schema": "ggml_hrx_kernel_bench.import_test_coverage.v1",
  "operation_count": 10,
  "total_pass_case_count": 30,
  "total_fail_case_count": 2,
  "operations": [
    {
      "op": "ADD",
      "pass_case_count": 2,
      "fail_case_count": 0
    },
    {
      "op": "CPY",
      "pass_case_count": 2,
      "fail_case_count": 0
    },
    {
      "op": "FLASH_ATTN_EXT",
      "pass_case_count": 2,
      "fail_case_count": 0
    },
    {
      "op": "GET_ROWS",
      "pass_case_count": 4,
      "fail_case_count": 0
    },
    {
      "op": "MUL",
      "pass_case_count": 2,
      "fail_case_count": 0
    },
    {
      "op": "MUL_MAT",
      "pass_case_count": 10,
      "fail_case_count": 0
    },
    {
      "op": "RMS_NORM",
      "pass_case_count": 2,
      "fail_case_count": 0
    },
    {
      "op": "ROPE",
      "pass_case_count": 4,
      "fail_case_count": 0
    },
    {
      "op": "SET_ROWS",
      "pass_case_count": 2,
      "fail_case_count": 0
    },
    {
      "op": "SWIGLU",
      "pass_case_count": 0,
      "fail_case_count": 2
    }
  ]
}
