{
  "schema": "ggml_hrx_kernel_bench.import_test_coverage.v1",
  "operation_count": 4,
  "operations": [
    {
      "op": "ABS",
      "pass_case_count": 0,
      "fail_case_count": 1
    },
    {
      "op": "ACC",
      "pass_case_count": 0,
      "fail_case_count": 1
    },
    {
      "op": "ADD",
      "pass_case_count": 0,
      "fail_case_count": 1
    },
    {
      "op": "CPY",
      "pass_case_count": 1,
      "fail_case_count": 1
    }
  ],
  "total_pass_case_count": 1,
  "total_fail_case_count": 4
}
