{
  "schema": "ggml_hrx_kernel_bench.import_test_coverage.v1",
  "operation_count": 4,
  "total_pass_case_count": 7,
  "total_fail_case_count": 0,
  "operations": [
    {
      "op": "FLASH_ATTN_EXT",
      "pass_case_count": 3,
      "fail_case_count": 0
    },
    {
      "op": "GET_ROWS",
      "pass_case_count": 1,
      "fail_case_count": 0
    },
    {
      "op": "QUANTIZE",
      "pass_case_count": 2,
      "fail_case_count": 0
    },
    {
      "op": "ROPE_SCALE",
      "pass_case_count": 1,
      "fail_case_count": 0
    }
  ]
}
